{
  "event_id": "evt:001",
  "operation_id": "op:001",
  "scope_id": "workspace:example",
  "object_id": "mem:decision:001",
  "version_id": "ver:decision:001:1",
  "event_type": "object_created",
  "recorded_at": "2026-07-17T00:00:00.000000Z",
  "sequence": 1,
  "actor": {"actor_id": "actor:agent:planner", "actor_kind": "agent"},
  "resource_usage": {
    "input_tokens": 1520,
    "output_tokens": 220,
    "cached_input_tokens": 512,
    "wall_clock_ms": 1830,
    "cost_amount": 0.0184,
    "cost_currency": "USD",
    "model_ref": "claude-sonnet-5",
    "provider_ref": "anthropic",
    "region_ref": "us-east-1"
  }
}
