{
    "event_id":  "evt:lifecycle:001",
    "operation_id":  "op:lifecycle:001",
    "scope_id":  "workspace:example",
    "object_id":  "mem:task:001",
    "version_id":  "ver:task:001:2",
    "event_type":  "lifecycle_transitioned",
    "recorded_at":  "2026-07-12T00:00:03Z",
    "sequence":  2,
    "actor":  {
                  "actor_id":  "actor:editor:001",
                  "actor_kind":  "human"
              },
    "payload":  {
                    "from":  "candidate",
                    "to":  "active"
                }
}
